{
  "schema_version": 1,
  "run_id": "cdt-scaling-v1-darwin-arm64-20260812",
  "recorded_at_utc": "2026-08-12T00:54:28Z",
  "implementation": {
    "name": "CDT-plusplus",
    "version": "1.0.0",
    "source_revision": "bd9cdbd373e274b200d7927fe4e4213df69000d2"
  },
  "toolchain": {
    "compiler": "AppleClang 21.0.0.21000101",
    "cxx_standard": 23,
    "standard_library": "libc++-210106",
    "cmake": "4.4.1",
    "cgal": "6.2-I-900",
    "tbb": "2023.1.0"
  },
  "build": {
    "profile": "Release",
    "preset": "parallel",
    "parallel_triangulation": true,
    "thread_counts": [
      1,
      2,
      4
    ]
  },
  "host": {
    "operating_system": "Darwin",
    "architecture": "arm64",
    "logical_threads": 16,
    "comparison_constraint": "All samples were recorded sequentially on the same host, binary, fixture, dependency baseline, warm-up policy, and measurement protocol."
  },
  "thread_count": 4,
  "seeds": {
    "root": 102,
    "initialization_stream": 0,
    "transition_stream": 1
  },
  "fixture_version": 1,
  "commands": [
    {
      "id": "scaling-threads-1",
      "artifacts": [
        "reference/raw/v1/scaling-threads-1.txt"
      ],
      "command_line": [
        "out/build/parallel/tests/CDT_cgal_benchmark",
        "640",
        "5",
        "50",
        "1",
        "1"
      ]
    },
    {
      "id": "scaling-threads-2",
      "artifacts": [
        "reference/raw/v1/scaling-threads-2.txt"
      ],
      "command_line": [
        "out/build/parallel/tests/CDT_cgal_benchmark",
        "640",
        "5",
        "50",
        "2",
        "1"
      ]
    },
    {
      "id": "scaling-threads-4",
      "artifacts": [
        "reference/raw/v1/scaling-threads-4.txt"
      ],
      "command_line": [
        "out/build/parallel/tests/CDT_cgal_benchmark",
        "640",
        "5",
        "50",
        "4",
        "1"
      ]
    }
  ],
  "artifacts": [
    {
      "path": "reference/raw/v1/scaling-threads-1.txt",
      "media_type": "text/plain",
      "sha256": "92dc938ee34db363432bd202489ad82777283a7c37a578bb5a5606524b621ec7"
    },
    {
      "path": "reference/raw/v1/scaling-threads-2.txt",
      "media_type": "text/plain",
      "sha256": "4bd520149faa1f386f610bf1eaf224d2e01abc5ccb51c0e82a0b68dc1343b790"
    },
    {
      "path": "reference/raw/v1/scaling-threads-4.txt",
      "media_type": "text/plain",
      "sha256": "e742ff773fc27722da7a130e02329b23ef9a822de90331d2c3216a30f6eefdba"
    }
  ],
  "verification": {
    "producer_regeneration": {
      "status": "passed",
      "source_revision": "bd9cdbd373e274b200d7927fe4e4213df69000d2",
      "recorded_at_utc": "2026-08-12T00:54:28Z"
    }
  }
}
