{
  "schema_version": 1,
  "run_id": "cdt-reference-v1-darwin-arm64-20260812",
  "recorded_at_utc": "2026-08-12T00:54:28Z",
  "implementation": {
    "name": "CDT-plusplus",
    "version": "1.0.0",
    "source_revision": "bd9cdbd373e274b200d7927fe4e4213df69000d2"
  },
  "toolchain": {
    "compiler": "AppleClang 21.0.0.21000101",
    "cxx_standard": 23,
    "standard_library": "libc++-210106",
    "cmake": "4.4.1",
    "cgal": "6.2-I-900"
  },
  "build": {
    "profile": "Release",
    "preset": "reference",
    "parallel_triangulation": false
  },
  "host": {
    "operating_system": "Darwin",
    "architecture": "arm64",
    "logical_threads": 16
  },
  "thread_count": 1,
  "seeds": {
    "causal_construction": null,
    "move_23_32": 10623,
    "move_26_62": 10626,
    "move_44": 10644,
    "bounded_end_to_end_root": 92
  },
  "fixture_version": 1,
  "commands": [
    {
      "id": "canonical-fixture",
      "artifacts": [
        "reference/raw/v1/cpp-reference.json"
      ],
      "command_line": [
        "out/build/reference/tests/CDT_reference_fixture"
      ]
    },
    {
      "id": "bounded-end-to-end",
      "artifacts": [
        "reference/raw/v1/end-to-end.txt"
      ],
      "command_line": [
        "out/build/reference/src/cdt",
        "-s",
        "-n2",
        "-t2",
        "-a1",
        "-k0",
        "-l1",
        "-p1",
        "-c1",
        "--seed",
        "92",
        "--threads",
        "1",
        "--no-output"
      ]
    },
    {
      "id": "persistence-roundtrip",
      "artifacts": [
        "reference/raw/v1/persistence-v1.off",
        "reference/raw/v1/persistence-v1.off.meta"
      ],
      "command_line": [
        "out/build/reference/src/initialize",
        "-s",
        "-n2",
        "-t2",
        "-o",
        "--seed",
        "92",
        "--threads",
        "1"
      ]
    }
  ],
  "artifacts": [
    {
      "path": "reference/raw/v1/cpp-reference.json",
      "media_type": "application/json",
      "sha256": "3d779030cd7f161e4edc444112997e2b421eb09da798823e0afbd7722667717c"
    },
    {
      "path": "reference/raw/v1/end-to-end.txt",
      "media_type": "text/plain",
      "sha256": "4ae492ac4821893e67607a689134e33e70c4bc24c1c6de64edddbd51ef035556"
    },
    {
      "path": "reference/raw/v1/persistence-v1.off",
      "media_type": "text/plain",
      "sha256": "2afe471c1517e4212f93f3acc2596f416411f4575f2201faecda098f4b0569ce"
    },
    {
      "path": "reference/raw/v1/persistence-v1.off.meta",
      "media_type": "text/plain",
      "sha256": "742c1b6c878889e1afca85390d62121cf967e1cf1ac76ddc4defe3732216565e"
    },
    {
      "path": "reference/fixtures/v1/protocol.json",
      "media_type": "application/json",
      "sha256": "d0d7bc91c35e3a1ee36e7fb18412d6bdb1b0dcd23f9579912e16f5913b5f13aa"
    },
    {
      "path": "reference/schema/fixture-v1.schema.json",
      "media_type": "application/schema+json",
      "sha256": "ac574dd4821562d54e6ea0f46087cec0461bd01e091c04d364c9511e901e4215"
    },
    {
      "path": "reference/schema/result-v1.schema.json",
      "media_type": "application/schema+json",
      "sha256": "8b7074b44cc98a70bae3612a748ecef24d05f16229343ba4505b0d453bf02977"
    },
    {
      "path": "reference/schema/run-manifest-v1.schema.json",
      "media_type": "application/schema+json",
      "sha256": "38c95bc5b0b2cadf726d9cba29eb820dec8ebb584e4adf8a86b2ac2c6151fd38"
    }
  ],
  "verification": {
    "producer_regeneration": {
      "status": "passed",
      "source_revision": "bd9cdbd373e274b200d7927fe4e4213df69000d2",
      "recorded_at_utc": "2026-08-12T00:54:28Z"
    }
  }
}
